{
    "pid": 3152,
    "tid": [
        1492
    ],
    "gettickcount": {
        "min": 1906437,
        "max": 1910437,
        "step": 1
    },
    "filetime": {
        "min": 132489479687980000,
        "max": 132489479688000000,
        "step": 10000
    },
    "perfcounter": {
        "min": 19084704950,
        "max": 19084705150,
        "step": 1
    }
}
